1,การเริ่มประทานวฮีย์ (วิวรณ์),كتاب بدء الوحى,1to7
2,ความศรัทธา (อีมาน),كتاب الإيمان,8to58
3,ความรู้,كتاب العلم,59to134
4,การอาบน้ำละหมาด (วุฎูอ์),كتاب الوضوء,135to247
5,การอาบน้ำชำระร่างกาย (ฆุสล),كتاب الغسل,248to293
6,ประจำเดือน (ฮัยฎ),كتاب الحيض,294to333
7,การทำความสะอาดด้วยฝุ่นดิน (ตัยยัมมุม),كتاب التيمم,334to348
8,การละหมาด (ศอลาต),كتاب الصلاة,349to520
9,เวลาของการละหมาด,كتاب مواقيت الصلاة,521to602
10,การประกาศเชิญชวนสู่การละหมาด (อาซาน),كتاب الأذان,603to875
11,การละหมาดวันศุกร์ (ญุมุอะฮ์),كتاب الجمعة,876to941
12,การละหมาดในยามภัยกลัว,كتاب صلاة الخوف,942to947
13,วันรื่นเริงทั้งสอง (อีดฟิตริและอีดอัฎฮา),كتاب العيدين,948to989
14,การละหมาดวิตร,كتاب الوتر,990to1004
15,การขอฝน (อิสติสกาอ์),كتاب الاستسقاء,1005to1039
16,สุริยคราสและจันทรคราส,كتاب الكسوف,1040to1065
17,การสุญูดเมื่ออ่านอัลกุรอาน,كتاب سجود القرآن,1067to1079
18,การย่อละหมาด,كتاب التقصير,1080to1119
19,การละหมาดในยามค่ำคืน (ตะฮัจญุด),كتاب التهجد,1120to1187
20,ความประเสริฐของการละหมาดที่มัสยิดมักกะห์และมาดีนะห์,كتاب فضل الصلاة فى مسجد مكة والمدينة,1188to1197
21,การกระทำต่างๆ ในละหมาด,كتاب العمل فى الصلاة,1198to1223
22,การหลงลืมในละหมาด (ซะฮว์),كتاب السهو,1224to1236
23,เรื่องศพ (ญะนาซะฮ์),كتاب الجنائز,1237to1394
24,การจ่ายทานบังคับ (ซะกาต),كتاب الزكاة,1395to1512
25,การประกอบพิธีฮัจญ์,كتاب الحج,1513to1771
26,การประกอบพิธีอุมเราะห์,كتاب العمرة,1773to1805
27,ผู้ถูกขัดขวางจากการประกอบพิธี,كتاب المحصر,1806to1820
28,บทลงโทษการล่าสัตว์ขณะครองตน,كتاب جزاء الصيد,1821to1866
29,ความประเสริฐของนครมาดีนะห์,كتاب فضائل المدينة,1867to1890
30,การถือศีลอด,كتاب الصوم,1891to2007
31,การละหมาดในคืนรอมฎอน (ตะรอวีห์),كتاب صلاة التراويح,2008to2013
32,ความประเสริฐของคืนลัยละตุลก็อดร,كتاب فضل ليلة القدر,2014to2024
33,การพำนักในมัสยิดเพื่อปฏิบัติธรรม (เอี๊ยะติกาฟ),كتاب الاعتكاف,2025to2046
34,การซื้อขาย,كتاب البيوع,2047to2238
35,การซื้อขายแบบสั่งจองล่วงหน้า (อัส-สะลัม),كتاب السلم,2239to2256
36,สิทธิการซื้อก่อน (ชุฟอะห์),كتاب الشفعة,2257to2259
37,การจ้างงาน (อิจาเราะห์),كتاب الإجارة,2260to2285
38,การโอนหนี้ (ฮะวาละห์),كتاب الحوالات,2287to2289
39,การค้ำประกัน (กะฟาละห์),كتاب الكفالة,2290to2298
40,การเป็นตัวแทน (วะกาละห์),كتاب الوكالة,2299to2319
41,การเพาะปลูก,كتاب المزارعة,2320to2350
42,การจัดสรรน้ำ,كتاب المساقاة,2351to2383
43,การกู้ยืม การชำระหนี้ และการล้มละลาย,كتاب فى الاستقراض,2385to2409
44,การโต้แย้งและคดีความ,كتاب الخصومات,2410to2425
45,ของตกหาย (ลุกอเตาะห์),كتاب فى اللقطة,2426to2439
46,การอธรรมและการร้องทุกข์,كتاب المظالم,2440to2482
47,หุ้นส่วน (ชะริกะห์),كتاب الشركة,2483to2507
48,การจำนอง,كتاب الرهن,2508to2515
49,การปลดปล่อยทาส,كتاب العتق,2517to2559
50,ทาสที่ทำสัญญาไถ่ถอนตนเอง (มุกาตับ),كتاب المكاتب,2560to2565
51,การให้ของขวัญและความประเสริฐของการให้,كتاب الهبة وفضلها والتحريض عليها,2566to2636
52,พยานหลักฐาน,كتاب الشهادات,2637to2689
53,การประนีประนอม,كتاب الصلح,2690to2710
54,เงื่อนไขต่างๆ,كتاب الشروط,2711to2737
55,พินัยกรรม (วะศียะห์),كتاب الوصايا,2738to2781
56,การต่อสู้ในหนทางของอัลลอฮ์ (ญิฮาด),كتاب الجهاد والسير,2782to3090
57,ทรัพย์หนึ่งในห้า (คุมุส),كتاب فرض الخمس,3091to3155
58,ภาษีรายหัวและการทำสนธิสัญญา (ญิซยะห์),كتاب الجزية والموادعة,3156to3189
59,การเริ่มบังเกิดสิ่งถูกสร้าง,كتاب بدء الخلق,3190to3325
60,เรื่องราวของบรรดาศาสดา,كتاب أحاديث الأنبياء,3326to3488
61,คุณธรรมของท่านศาสดาและบรรดาสาวก,كتاب المناقب,3489to3648
62,ความประเสริฐของสาวก (ซอฮาบะฮ์),كتاب فضائل أصحاب النبى صلى الله عليه وسلم,3649to3775
63,คุณธรรมของชาวอันศอร (ผู้ช่วยเหลือ),كتاب مناقب الأنصار,3776to3948
64,สงครามที่ท่านศาสดานำทัพ (อัล-มะฆอซี),كتاب المغازى,3949to4473
65,การอรรถาธิบายอัลกุรอาน (ตัฟซีร),كتاب التفسير,4474to4977
66,ความประเสริฐของอัลกุรอาน,كتاب فضائل القرآن,4978to5062
67,การแต่งงาน (นิกาห์),كتاب النكاح,5063to5250
68,การหย่าร้าง,كتاب الطلاق,5251to5350
69,ค่าเลี้ยงดูครอบครัว,كتاب النفقات,5351to5372
70,อาหารและการกิน,كتاب الأطعمة,5373to5466
71,การทำอะกีเกาะห์ (ฉลองเด็กแรกเกิด),كتاب العقيقة,5467to5474
72,การล่าสัตว์และการเชือดสัตว์,كتاب الذبائح والصيد,5475to5544
73,สัตว์พลีทานในวันอีด (กุรบาน),كتاب الأضاحي,5545to5574
74,เครื่องดื่ม,كتاب الأشربة,5575to5639
75,ผู้ป่วย,كتاب المرضى,5640to5677
76,การแพทย์,كتاب الطب,5678to5782
77,เครื่องแต่งกาย,كتاب اللباس,5783to5969
78,มารยาทอันดีงาม,كتاب الأدب,5970to6226
79,การขออนุญาต,كتاب الاستئذان,6227to6303
80,การขอดุอา (บทขอพร),كتاب الدعوات,6304to6411
81,สิ่งที่ทำให้จิตใจอ่อนโยน,كتاب الرقاق,6412to6593
82,กำหนดสภาวะการณ์ (กอดัร),كتاب القدر,6594to6620
83,การสาบานและการบนบาน,كتاب الأيمان والنذور,6621to6707
84,การไถ่ถอนคำสาบาน,كتاب كفارات الأيمان,6708to6722
85,กฎหมายมรดก,كتاب الفرائض,6723to6771
86,บทลงโทษทางอาญา (ฮุดูด),كتاب الحدود,6772to6859
87,ค่าสินไหมทดแทน (ดิยะห์),كتاب الديات,6861to6917
88,การให้ผู้ตกรีตกลับตัว,كتاب استتابة المرتدين والمعاندين وقتالهم,6918to6939
89,การถูกบังคับให้กระทำ,كتاب الإكراه,6940to6952
90,กลอุบาย,كتاب الحيل,6953to6981
91,การทำนายฝัน,كتاب التعبير,6982to7047
92,ความวุ่นวายและวันสิ้นโลก (ฟิตนะฮ์),كتاب الفتن,7048to7136
93,การตัดสินข้อชี้ขาด (อะห์กาม),كتاب الأحكام,7137to7225
94,ความปรารถนา,كتاب التمنى,7226to7245
95,การรับฟังข่าวจากคนคนเดียว (อาฮาด),كتاب أخبار الآحاد,7246to7267
96,การยึดมั่นในอัลกุรอานและซุนนะห์,كتاب الاعتصام بالكتاب والسنة,7268to7370
97,เอกภาพของอัลลอฮ์ (เตาฮีด),كتاب التوحيد,7371to7563
